[
  {
    "event_id": "evt_01M3KY5QG0N78N5N8D6M3ZDSFD",
    "assembly_id": "asm_e7_planned",
    "version": 1,
    "timestamp": "2026-09-28T12:00:00.000Z",
    "client_timestamp": "2026-09-28T12:00:00.000Z",
    "kind": "part_state",
    "part_id": "part_e7_l01_slab",
    "previous_state": "missing",
    "new_state": "built",
    "source": "system",
    "confidence": 1,
    "actor": "planner",
    "step_id": "step_01",
    "note": "planned"
  },
  {
    "event_id": "evt_01M4QZQSG0G04PCQM7KBAT9P5Q",
    "assembly_id": "asm_e7_planned",
    "version": 2,
    "timestamp": "2026-10-12T12:00:00.000Z",
    "client_timestamp": "2026-10-12T12:00:00.000Z",
    "kind": "part_state",
    "part_id": "part_e7_l01_envelope",
    "previous_state": "missing",
    "new_state": "built",
    "source": "system",
    "confidence": 1,
    "actor": "planner",
    "step_id": "step_02",
    "note": "planned"
  },
  {
    "event_id": "evt_01M5A0GTG0EGXD7N7QJFTR8EQ0",
    "assembly_id": "asm_e7_planned",
    "version": 3,
    "timestamp": "2026-10-19T12:00:00.000Z",
    "client_timestamp": "2026-10-19T12:00:00.000Z",
    "kind": "part_state",
    "part_id": "part_e7_l02_slab",
    "previous_state": "missing",
    "new_state": "built",
    "source": "system",
    "confidence": 1,
    "actor": "planner",
    "step_id": "step_03",
    "note": "planned"
  },
  {
    "event_id": "evt_01M6E22WG0KMQ71GD3ZNMNE8KE",
    "assembly_id": "asm_e7_planned",
    "version": 4,
    "timestamp": "2026-11-02T12:00:00.000Z",
    "client_timestamp": "2026-11-02T12:00:00.000Z",
    "kind": "part_state",
    "part_id": "part_e7_l02_envelope",
    "previous_state": "missing",
    "new_state": "built",
    "source": "system",
    "confidence": 1,
    "actor": "planner",
    "step_id": "step_04",
    "note": "planned"
  },
  {
    "event_id": "evt_01M702VXG0FFZ97XHG1S46T9Z6",
    "assembly_id": "asm_e7_planned",
    "version": 5,
    "timestamp": "2026-11-09T12:00:00.000Z",
    "client_timestamp": "2026-11-09T12:00:00.000Z",
    "kind": "part_state",
    "part_id": "part_e7_l03_slab",
    "previous_state": "missing",
    "new_state": "built",
    "source": "system",
    "confidence": 1,
    "actor": "planner",
    "step_id": "step_05",
    "note": "planned"
  },
  {
    "event_id": "evt_01M844DZG0GW930ZJ8NKG6CWGM",
    "assembly_id": "asm_e7_planned",
    "version": 6,
    "timestamp": "2026-11-23T12:00:00.000Z",
    "client_timestamp": "2026-11-23T12:00:00.000Z",
    "kind": "part_state",
    "part_id": "part_e7_l03_envelope",
    "previous_state": "missing",
    "new_state": "built",
    "source": "system",
    "confidence": 1,
    "actor": "planner",
    "step_id": "step_06",
    "note": "planned"
  },
  {
    "event_id": "evt_01M8P570G0CGRDTMSNCN9J52M7",
    "assembly_id": "asm_e7_planned",
    "version": 7,
    "timestamp": "2026-11-30T12:00:00.000Z",
    "client_timestamp": "2026-11-30T12:00:00.000Z",
    "kind": "part_state",
    "part_id": "part_e7_l04_slab",
    "previous_state": "missing",
    "new_state": "built",
    "source": "system",
    "confidence": 1,
    "actor": "planner",
    "step_id": "step_07",
    "note": "planned"
  },
  {
    "event_id": "evt_01M9T6S2G0G138DXP7XSYTK0T7",
    "assembly_id": "asm_e7_planned",
    "version": 8,
    "timestamp": "2026-12-14T12:00:00.000Z",
    "client_timestamp": "2026-12-14T12:00:00.000Z",
    "kind": "part_state",
    "part_id": "part_e7_l04_envelope",
    "previous_state": "missing",
    "new_state": "built",
    "source": "system",
    "confidence": 1,
    "actor": "planner",
    "step_id": "step_08",
    "note": "planned"
  },
  {
    "event_id": "evt_01MAC7J3G0ACEHT6E362B2NWM0",
    "assembly_id": "asm_e7_planned",
    "version": 9,
    "timestamp": "2026-12-21T12:00:00.000Z",
    "client_timestamp": "2026-12-21T12:00:00.000Z",
    "kind": "part_state",
    "part_id": "part_e7_l05_slab",
    "previous_state": "missing",
    "new_state": "built",
    "source": "system",
    "confidence": 1,
    "actor": "planner",
    "step_id": "step_09",
    "note": "planned"
  },
  {
    "event_id": "evt_01MBG945G09ZTHJD2CENM9C571",
    "assembly_id": "asm_e7_planned",
    "version": 10,
    "timestamp": "2027-01-04T12:00:00.000Z",
    "client_timestamp": "2027-01-04T12:00:00.000Z",
    "kind": "part_state",
    "part_id": "part_e7_l05_envelope",
    "previous_state": "missing",
    "new_state": "built",
    "source": "system",
    "confidence": 1,
    "actor": "planner",
    "step_id": "step_10",
    "note": "planned"
  },
  {
    "event_id": "evt_01MC29X6G0XQ883P3XQDT62B9N",
    "assembly_id": "asm_e7_planned",
    "version": 11,
    "timestamp": "2027-01-11T12:00:00.000Z",
    "client_timestamp": "2027-01-11T12:00:00.000Z",
    "kind": "part_state",
    "part_id": "part_e7_l06_slab",
    "previous_state": "missing",
    "new_state": "built",
    "source": "system",
    "confidence": 1,
    "actor": "planner",
    "step_id": "step_11",
    "note": "planned"
  },
  {
    "event_id": "evt_01MD6BF8G0BXZ0BTMMPH8EJNF4",
    "assembly_id": "asm_e7_planned",
    "version": 12,
    "timestamp": "2027-01-25T12:00:00.000Z",
    "client_timestamp": "2027-01-25T12:00:00.000Z",
    "kind": "part_state",
    "part_id": "part_e7_l06_envelope",
    "previous_state": "missing",
    "new_state": "built",
    "source": "system",
    "confidence": 1,
    "actor": "planner",
    "step_id": "step_12",
    "note": "planned"
  },
  {
    "event_id": "evt_01MDRC89G0GSAMRQH4MZ80Y6H0",
    "assembly_id": "asm_e7_planned",
    "version": 13,
    "timestamp": "2027-02-01T12:00:00.000Z",
    "client_timestamp": "2027-02-01T12:00:00.000Z",
    "kind": "part_state",
    "part_id": "part_e7_l07_slab",
    "previous_state": "missing",
    "new_state": "built",
    "source": "system",
    "confidence": 1,
    "actor": "planner",
    "step_id": "step_13",
    "note": "planned"
  },
  {
    "event_id": "evt_01MEWDTBG062ZXW30NH2P0XRCR",
    "assembly_id": "asm_e7_planned",
    "version": 14,
    "timestamp": "2027-02-15T12:00:00.000Z",
    "client_timestamp": "2027-02-15T12:00:00.000Z",
    "kind": "part_state",
    "part_id": "part_e7_l07_envelope",
    "previous_state": "missing",
    "new_state": "built",
    "source": "system",
    "confidence": 1,
    "actor": "planner",
    "step_id": "step_14",
    "note": "planned"
  },
  {
    "event_id": "evt_01MFEEKCG09EGBT3N9NCV46PX9",
    "assembly_id": "asm_e7_planned",
    "version": 15,
    "timestamp": "2027-02-22T12:00:00.000Z",
    "client_timestamp": "2027-02-22T12:00:00.000Z",
    "kind": "part_state",
    "part_id": "part_e7_l08_slab",
    "previous_state": "missing",
    "new_state": "built",
    "source": "system",
    "confidence": 1,
    "actor": "planner",
    "step_id": "step_15",
    "note": "planned"
  },
  {
    "event_id": "evt_01MGJG5EG06CKK3TMJ686H1441",
    "assembly_id": "asm_e7_planned",
    "version": 16,
    "timestamp": "2027-03-08T12:00:00.000Z",
    "client_timestamp": "2027-03-08T12:00:00.000Z",
    "kind": "part_state",
    "part_id": "part_e7_l08_envelope",
    "previous_state": "missing",
    "new_state": "built",
    "source": "system",
    "confidence": 1,
    "actor": "planner",
    "step_id": "step_16",
    "note": "planned"
  },
  {
    "event_id": "evt_01MJ8JGHG0N7H6NE0QPSWJP2XZ",
    "assembly_id": "asm_e7_planned",
    "version": 17,
    "timestamp": "2027-03-29T12:00:00.000Z",
    "client_timestamp": "2027-03-29T12:00:00.000Z",
    "kind": "part_state",
    "part_id": "part_e7_roof",
    "previous_state": "missing",
    "new_state": "built",
    "source": "system",
    "confidence": 1,
    "actor": "planner",
    "step_id": "step_17",
    "note": "planned"
  }
]
